<?xml version="1.0" encoding="UTF-8"?>
<!--Sample XML file generated by XMLSpy v2011 sp1 (http://www.altova.com)-->
<!--
CoffeeType -> Latte; Min Price -> makeCoffeeServiceBinding01
CoffeeType -> Expresso; Min Price -> makeCoffeeServiceBinding02
CoffeeType -> Caffuccino; Min Price -> makeCoffeeServiceBinding03 
	 -->
<n1:scoreFactor xsi:schemaLocation="http://jaxb.semblog.sw.ecs.soton.uk.ac/scoreFactor.xsd" xmlns:n1="http://jaxb.semblog.sw.ecs.soton.uk.ac/" xmlns:xsi="http://www.w3.org/2001/XMLSchema-instance">
	<scoreFactor>
		<scoreFactorBean>dateScoreFactor</scoreFactorBean>		
		<defaultWeightage>0.4</defaultWeightage>
	</scoreFactor>
	<scoreFactor>
		<scoreFactorBean>predicateScoreFactor</scoreFactorBean>		
		<defaultWeightage>0.3</defaultWeightage>
	</scoreFactor>
	<scoreFactor>
		<scoreFactorBean>vectorDistanceScoreFactor</scoreFactorBean>		
		<defaultWeightage>0.3</defaultWeightage>
	</scoreFactor>
	
</n1:scoreFactor>
